{
  "schemaVersion": "1.0",
  "manifestType": "template",
  "catalogVersion": "0.4.0",
  "id": "technical-whitepaper",
  "version": "1.0.0",
  "displayName": "技术白皮书",
  "description": "以架构、原理、接口和风险说明一项技术方案。",
  "status": "active",
  "contentType": "paper",
  "artifactType": "webpage",
  "tags": [
    "论文",
    "技术",
    "架构",
    "原创模板",
    "本地知识库"
  ],
  "inputFormats": [
    "plainText",
    "markdown",
    "docx",
    "xlsx",
    "pdf"
  ],
  "outputFormats": [
    "markdown",
    "html",
    "pdf"
  ],
  "entrypoint": "technical-whitepaper/template.md",
  "files": [
    {
      "path": "technical-whitepaper/template.md",
      "kind": "markdown",
      "editable": true,
      "contentHash": "sha256:70d1163286e560029d3169388ce9c7506ba83caf0a2d890c548d846ebff7bd9e"
    }
  ],
  "editableSurfaces": [
    "content"
  ],
  "agentCapabilities": [
    "creation.generate",
    "creation.edit"
  ],
  "sandbox": {
    "network": false,
    "shell": false,
    "vaultWrite": false,
    "allowTopNavigation": false,
    "allowPopups": false,
    "allowExternalScripts": false
  },
  "compatibility": {
    "minRuntimeVersion": "0.1.2",
    "previewMode": "sandboxedIframe"
  },
  "source": {
    "policy": "yunspire_first_party",
    "authoredBy": "Yunspire",
    "repository": "https://github.com/Leo-sail/yunspire",
    "upstreamCodeCopied": false,
    "researchBoundary": "This template is an original Yunspire project asset. External repositories informed capability research only; no upstream code, prompt, template, wording, or visual asset is included."
  },
  "license": {
    "scope": "yunspire_first_party_project_asset",
    "notice": "Original Yunspire template manifest and Markdown entrypoint; use is governed by the repository LICENSE.",
    "thirdPartyAssets": []
  }
}
