{
  "schemaVersion": "1.0",
  "manifestType": "template",
  "catalogVersion": "0.4.0",
  "id": "trend-forecast",
  "version": "1.0.0",
  "displayName": "趋势研判",
  "description": "将已发生的信号、驱动因素与不确定性组织成可审阅的趋势判断。",
  "status": "active",
  "contentType": "article",
  "artifactType": "dashboard",
  "tags": [
    "趋势",
    "研判",
    "指标",
    "原创模板",
    "本地知识库"
  ],
  "inputFormats": [
    "plainText",
    "markdown",
    "docx",
    "pdf",
    "json",
    "csv",
    "tsv",
    "xlsx"
  ],
  "outputFormats": [
    "markdown",
    "html"
  ],
  "entrypoint": "trend-forecast/template.md",
  "files": [
    {
      "path": "trend-forecast/template.md",
      "kind": "markdown",
      "editable": true,
      "contentHash": "sha256:dc510b09458ab0133805b4dfca0e6f1da22a26f8b8f13603d353c46df948519d"
    }
  ],
  "editableSurfaces": [
    "content",
    "data"
  ],
  "agentCapabilities": [
    "creation.generate",
    "creation.edit"
  ],
  "sandbox": {
    "network": false,
    "shell": false,
    "vaultWrite": false,
    "allowTopNavigation": false,
    "allowPopups": false,
    "allowExternalScripts": false
  },
  "compatibility": {
    "minRuntimeVersion": "0.1.2",
    "previewMode": "sandboxedIframe"
  },
  "source": {
    "policy": "yunspire_first_party",
    "authoredBy": "Yunspire",
    "repository": "https://github.com/Leo-sail/yunspire",
    "upstreamCodeCopied": false,
    "researchBoundary": "This template is an original Yunspire project asset. External repositories informed capability research only; no upstream code, prompt, template, wording, or visual asset is included."
  },
  "license": {
    "scope": "yunspire_first_party_project_asset",
    "notice": "Original Yunspire template manifest and Markdown entrypoint; use is governed by the repository LICENSE.",
    "thirdPartyAssets": []
  }
}
