{
  "schemaVersion": "1.0",
  "manifestType": "template",
  "catalogVersion": "0.4.0",
  "id": "brand-collaboration",
  "version": "1.0.0",
  "displayName": "品牌合作协议",
  "description": "约定合作目标、品牌使用、交付内容、审核和结算方式。",
  "status": "active",
  "contentType": "contract",
  "artifactType": "report",
  "tags": [
    "合同",
    "品牌",
    "合作",
    "原创模板",
    "本地知识库"
  ],
  "inputFormats": [
    "plainText",
    "markdown",
    "docx",
    "pdf"
  ],
  "outputFormats": [
    "markdown",
    "html",
    "pdf"
  ],
  "entrypoint": "brand-collaboration/template.md",
  "files": [
    {
      "path": "brand-collaboration/template.md",
      "kind": "markdown",
      "editable": true,
      "contentHash": "sha256:4845714104f7deaf200a42a0d154d6df36abf7faf3d66e0d5b093507c840eb05"
    }
  ],
  "editableSurfaces": [
    "content"
  ],
  "agentCapabilities": [
    "creation.generate",
    "creation.edit"
  ],
  "sandbox": {
    "network": false,
    "shell": false,
    "vaultWrite": false,
    "allowTopNavigation": false,
    "allowPopups": false,
    "allowExternalScripts": false
  },
  "compatibility": {
    "minRuntimeVersion": "0.1.2",
    "previewMode": "sandboxedIframe"
  },
  "source": {
    "policy": "yunspire_first_party",
    "authoredBy": "Yunspire",
    "repository": "https://github.com/Leo-sail/yunspire",
    "upstreamCodeCopied": false,
    "researchBoundary": "This template is an original Yunspire project asset. External repositories informed capability research only; no upstream code, prompt, template, wording, or visual asset is included."
  },
  "license": {
    "scope": "yunspire_first_party_project_asset",
    "notice": "Original Yunspire template manifest and Markdown entrypoint; use is governed by the repository LICENSE.",
    "thirdPartyAssets": []
  }
}
