{
  "schemaVersion": "1.0",
  "manifestType": "template",
  "catalogVersion": "0.4.0",
  "id": "wechat-interview",
  "version": "1.0.0",
  "displayName": "公众号访谈",
  "description": "以问答节奏降低阅读门槛，同时保留背景、原话和编辑核验。",
  "status": "active",
  "contentType": "wechat",
  "artifactType": "wechatArticle",
  "tags": [
    "公众号",
    "访谈",
    "人物",
    "原创模板",
    "本地知识库"
  ],
  "inputFormats": [
    "plainText",
    "markdown",
    "docx",
    "pdf"
  ],
  "outputFormats": [
    "markdown",
    "html"
  ],
  "entrypoint": "wechat-interview/template.md",
  "files": [
    {
      "path": "wechat-interview/template.md",
      "kind": "markdown",
      "editable": true,
      "contentHash": "sha256:36799e28a879a59dac3fdcbfa2d6b5f7c6f51533318fc5951d66d651101cd8e5"
    }
  ],
  "editableSurfaces": [
    "content"
  ],
  "agentCapabilities": [
    "creation.generate",
    "creation.edit"
  ],
  "sandbox": {
    "network": false,
    "shell": false,
    "vaultWrite": false,
    "allowTopNavigation": false,
    "allowPopups": false,
    "allowExternalScripts": false
  },
  "compatibility": {
    "minRuntimeVersion": "0.1.2",
    "previewMode": "sandboxedIframe"
  },
  "source": {
    "policy": "yunspire_first_party",
    "authoredBy": "Yunspire",
    "repository": "https://github.com/Leo-sail/yunspire",
    "upstreamCodeCopied": false,
    "researchBoundary": "This template is an original Yunspire project asset. External repositories informed capability research only; no upstream code, prompt, template, wording, or visual asset is included."
  },
  "license": {
    "scope": "yunspire_first_party_project_asset",
    "notice": "Original Yunspire template manifest and Markdown entrypoint; use is governed by the repository LICENSE.",
    "thirdPartyAssets": []
  }
}
