{
  "schemaVersion": "1.0",
  "manifestType": "template",
  "catalogVersion": "0.4.0",
  "id": "wechat-depth",
  "version": "1.0.0",
  "displayName": "公众号深度文",
  "description": "以清晰导语、章节节奏和来源注打造适合公众号阅读的深度文章。",
  "status": "active",
  "contentType": "wechat",
  "artifactType": "wechatArticle",
  "tags": [
    "公众号",
    "深度",
    "移动阅读",
    "原创模板",
    "本地知识库"
  ],
  "inputFormats": [
    "plainText",
    "markdown",
    "docx",
    "pdf"
  ],
  "outputFormats": [
    "markdown",
    "html"
  ],
  "entrypoint": "wechat-depth/template.md",
  "files": [
    {
      "path": "wechat-depth/template.md",
      "kind": "markdown",
      "editable": true,
      "contentHash": "sha256:5d89515fcc2670e272c170fddb2370d4778dc5aca9c82f12d681b7b9d25c21b1"
    }
  ],
  "editableSurfaces": [
    "content"
  ],
  "agentCapabilities": [
    "creation.generate",
    "creation.edit"
  ],
  "sandbox": {
    "network": false,
    "shell": false,
    "vaultWrite": false,
    "allowTopNavigation": false,
    "allowPopups": false,
    "allowExternalScripts": false
  },
  "compatibility": {
    "minRuntimeVersion": "0.1.2",
    "previewMode": "sandboxedIframe"
  },
  "source": {
    "policy": "yunspire_first_party",
    "authoredBy": "Yunspire",
    "repository": "https://github.com/Leo-sail/yunspire",
    "upstreamCodeCopied": false,
    "researchBoundary": "This template is an original Yunspire project asset. External repositories informed capability research only; no upstream code, prompt, template, wording, or visual asset is included."
  },
  "license": {
    "scope": "yunspire_first_party_project_asset",
    "notice": "Original Yunspire template manifest and Markdown entrypoint; use is governed by the repository LICENSE.",
    "thirdPartyAssets": []
  }
}
