{
  "schemaVersion": "1.0",
  "manifestType": "template",
  "catalogVersion": "0.4.0",
  "id": "wechat-hot-commentary",
  "version": "1.0.0",
  "displayName": "热点评论",
  "description": "快速回应热点，同时保留事实核验、观点边界和后续观察指标。",
  "status": "active",
  "contentType": "wechat",
  "artifactType": "wechatArticle",
  "tags": [
    "公众号",
    "热点",
    "评论",
    "原创模板",
    "本地知识库"
  ],
  "inputFormats": [
    "plainText",
    "markdown",
    "docx",
    "pdf"
  ],
  "outputFormats": [
    "markdown",
    "html"
  ],
  "entrypoint": "wechat-hot-commentary/template.md",
  "files": [
    {
      "path": "wechat-hot-commentary/template.md",
      "kind": "markdown",
      "editable": true,
      "contentHash": "sha256:53f9d0ff76bc036610469633d2ae07e951ef590c4cad357da1aad643e598ffc8"
    }
  ],
  "editableSurfaces": [
    "content"
  ],
  "agentCapabilities": [
    "creation.generate",
    "creation.edit"
  ],
  "sandbox": {
    "network": false,
    "shell": false,
    "vaultWrite": false,
    "allowTopNavigation": false,
    "allowPopups": false,
    "allowExternalScripts": false
  },
  "compatibility": {
    "minRuntimeVersion": "0.1.2",
    "previewMode": "sandboxedIframe"
  },
  "source": {
    "policy": "yunspire_first_party",
    "authoredBy": "Yunspire",
    "repository": "https://github.com/Leo-sail/yunspire",
    "upstreamCodeCopied": false,
    "researchBoundary": "This template is an original Yunspire project asset. External repositories informed capability research only; no upstream code, prompt, template, wording, or visual asset is included."
  },
  "license": {
    "scope": "yunspire_first_party_project_asset",
    "notice": "Original Yunspire template manifest and Markdown entrypoint; use is governed by the repository LICENSE.",
    "thirdPartyAssets": []
  }
}
