{
  "schemaVersion": "1.0",
  "manifestType": "template",
  "catalogVersion": "0.4.0",
  "id": "maintenance-agreement",
  "version": "1.0.0",
  "displayName": "维护服务合同",
  "description": "约定服务级别、响应时间、维护范围、升级和停机通知。",
  "status": "active",
  "contentType": "contract",
  "artifactType": "report",
  "tags": [
    "合同",
    "维护",
    "服务级别",
    "原创模板",
    "本地知识库"
  ],
  "inputFormats": [
    "plainText",
    "markdown",
    "docx",
    "pdf"
  ],
  "outputFormats": [
    "markdown",
    "html",
    "pdf"
  ],
  "entrypoint": "maintenance-agreement/template.md",
  "files": [
    {
      "path": "maintenance-agreement/template.md",
      "kind": "markdown",
      "editable": true,
      "contentHash": "sha256:680b3d64748b8b9fbc03ac866212b6c9107ebee12b410286c6d75f34367c9539"
    }
  ],
  "editableSurfaces": [
    "content"
  ],
  "agentCapabilities": [
    "creation.generate",
    "creation.edit"
  ],
  "sandbox": {
    "network": false,
    "shell": false,
    "vaultWrite": false,
    "allowTopNavigation": false,
    "allowPopups": false,
    "allowExternalScripts": false
  },
  "compatibility": {
    "minRuntimeVersion": "0.1.2",
    "previewMode": "sandboxedIframe"
  },
  "source": {
    "policy": "yunspire_first_party",
    "authoredBy": "Yunspire",
    "repository": "https://github.com/Leo-sail/yunspire",
    "upstreamCodeCopied": false,
    "researchBoundary": "This template is an original Yunspire project asset. External repositories informed capability research only; no upstream code, prompt, template, wording, or visual asset is included."
  },
  "license": {
    "scope": "yunspire_first_party_project_asset",
    "notice": "Original Yunspire template manifest and Markdown entrypoint; use is governed by the repository LICENSE.",
    "thirdPartyAssets": []
  }
}
