{
  "schemaVersion": "1.0",
  "manifestType": "template",
  "catalogVersion": "0.4.0",
  "id": "industry-observation",
  "version": "1.0.0",
  "displayName": "行业观察",
  "description": "记录行业变化、参与者动作与可能的结构性机会。",
  "status": "active",
  "contentType": "article",
  "artifactType": "report",
  "tags": [
    "行业",
    "观察",
    "趋势",
    "原创模板",
    "本地知识库"
  ],
  "inputFormats": [
    "plainText",
    "markdown",
    "docx",
    "pdf"
  ],
  "outputFormats": [
    "markdown",
    "html"
  ],
  "entrypoint": "industry-observation/template.md",
  "files": [
    {
      "path": "industry-observation/template.md",
      "kind": "markdown",
      "editable": true,
      "contentHash": "sha256:d272b5f5d4bffb04c76e1aaca65af7eae962ec15f1ea1f242b39f57d4dba7da2"
    }
  ],
  "editableSurfaces": [
    "content"
  ],
  "agentCapabilities": [
    "creation.generate",
    "creation.edit"
  ],
  "sandbox": {
    "network": false,
    "shell": false,
    "vaultWrite": false,
    "allowTopNavigation": false,
    "allowPopups": false,
    "allowExternalScripts": false
  },
  "compatibility": {
    "minRuntimeVersion": "0.1.2",
    "previewMode": "sandboxedIframe"
  },
  "source": {
    "policy": "yunspire_first_party",
    "authoredBy": "Yunspire",
    "repository": "https://github.com/Leo-sail/yunspire",
    "upstreamCodeCopied": false,
    "researchBoundary": "This template is an original Yunspire project asset. External repositories informed capability research only; no upstream code, prompt, template, wording, or visual asset is included."
  },
  "license": {
    "scope": "yunspire_first_party_project_asset",
    "notice": "Original Yunspire template manifest and Markdown entrypoint; use is governed by the repository LICENSE.",
    "thirdPartyAssets": []
  }
}
