{
  "schemaVersion": "1.0",
  "manifestType": "template",
  "catalogVersion": "0.4.0",
  "id": "methodology-paper",
  "version": "1.0.0",
  "displayName": "方法论文",
  "description": "说明一种研究或分析方法的步骤、适用范围与比较基线。",
  "status": "active",
  "contentType": "paper",
  "artifactType": "report",
  "tags": [
    "论文",
    "方法",
    "边界",
    "原创模板",
    "本地知识库"
  ],
  "inputFormats": [
    "plainText",
    "markdown",
    "docx",
    "xlsx",
    "pdf"
  ],
  "outputFormats": [
    "markdown",
    "html",
    "pdf"
  ],
  "entrypoint": "methodology-paper/template.md",
  "files": [
    {
      "path": "methodology-paper/template.md",
      "kind": "markdown",
      "editable": true,
      "contentHash": "sha256:0e246d9c7b844e6374619aa22ed944b4b451bc50b469c6262fb89358b0283ec2"
    }
  ],
  "editableSurfaces": [
    "content"
  ],
  "agentCapabilities": [
    "creation.generate",
    "creation.edit"
  ],
  "sandbox": {
    "network": false,
    "shell": false,
    "vaultWrite": false,
    "allowTopNavigation": false,
    "allowPopups": false,
    "allowExternalScripts": false
  },
  "compatibility": {
    "minRuntimeVersion": "0.1.2",
    "previewMode": "sandboxedIframe"
  },
  "source": {
    "policy": "yunspire_first_party",
    "authoredBy": "Yunspire",
    "repository": "https://github.com/Leo-sail/yunspire",
    "upstreamCodeCopied": false,
    "researchBoundary": "This template is an original Yunspire project asset. External repositories informed capability research only; no upstream code, prompt, template, wording, or visual asset is included."
  },
  "license": {
    "scope": "yunspire_first_party_project_asset",
    "notice": "Original Yunspire template manifest and Markdown entrypoint; use is governed by the repository LICENSE.",
    "thirdPartyAssets": []
  }
}
