{
  "schemaVersion": "1.0",
  "manifestType": "template",
  "catalogVersion": "0.4.0",
  "id": "xhs-itinerary",
  "version": "1.0.0",
  "displayName": "小红书行程攻略",
  "description": "将目的地、时间安排、预算和避坑信息整理成可执行攻略。",
  "status": "active",
  "contentType": "xiaohongshu",
  "artifactType": "socialPost",
  "tags": [
    "小红书",
    "行程",
    "攻略",
    "原创模板",
    "本地知识库"
  ],
  "inputFormats": [
    "plainText",
    "markdown",
    "image"
  ],
  "outputFormats": [
    "markdown",
    "html",
    "png",
    "jpeg"
  ],
  "entrypoint": "xhs-itinerary/template.md",
  "files": [
    {
      "path": "xhs-itinerary/template.md",
      "kind": "markdown",
      "editable": true,
      "contentHash": "sha256:49d98dfd175d63c76d219786edd0b420c91854e764645bdb731e028c7ea22882"
    }
  ],
  "editableSurfaces": [
    "content"
  ],
  "agentCapabilities": [
    "creation.generate",
    "creation.edit"
  ],
  "sandbox": {
    "network": false,
    "shell": false,
    "vaultWrite": false,
    "allowTopNavigation": false,
    "allowPopups": false,
    "allowExternalScripts": false
  },
  "compatibility": {
    "minRuntimeVersion": "0.1.2",
    "previewMode": "sandboxedIframe"
  },
  "source": {
    "policy": "yunspire_first_party",
    "authoredBy": "Yunspire",
    "repository": "https://github.com/Leo-sail/yunspire",
    "upstreamCodeCopied": false,
    "researchBoundary": "This template is an original Yunspire project asset. External repositories informed capability research only; no upstream code, prompt, template, wording, or visual asset is included."
  },
  "license": {
    "scope": "yunspire_first_party_project_asset",
    "notice": "Original Yunspire template manifest and Markdown entrypoint; use is governed by the repository LICENSE.",
    "thirdPartyAssets": []
  }
}
