{
  "schemaVersion": "1.0",
  "manifestType": "template",
  "catalogVersion": "0.4.0",
  "id": "problem-solution",
  "version": "1.0.0",
  "displayName": "问题方案",
  "description": "从一个可观察问题出发，提出分阶段、可验证的解决方案。",
  "status": "active",
  "contentType": "article",
  "artifactType": "interactiveTool",
  "tags": [
    "问题",
    "方案",
    "实施",
    "原创模板",
    "本地知识库"
  ],
  "inputFormats": [
    "plainText",
    "markdown",
    "docx",
    "pdf",
    "json",
    "csv",
    "tsv",
    "xlsx"
  ],
  "outputFormats": [
    "markdown",
    "html"
  ],
  "entrypoint": "problem-solution/template.md",
  "files": [
    {
      "path": "problem-solution/template.md",
      "kind": "markdown",
      "editable": true,
      "contentHash": "sha256:416d9d9d2b40476ac55184e92d5780a6228a48d458c0c16d9c67965e32a2d15f"
    }
  ],
  "editableSurfaces": [
    "content"
  ],
  "agentCapabilities": [
    "creation.generate",
    "creation.edit"
  ],
  "sandbox": {
    "network": false,
    "shell": false,
    "vaultWrite": false,
    "allowTopNavigation": false,
    "allowPopups": false,
    "allowExternalScripts": false
  },
  "compatibility": {
    "minRuntimeVersion": "0.1.2",
    "previewMode": "sandboxedIframe"
  },
  "source": {
    "policy": "yunspire_first_party",
    "authoredBy": "Yunspire",
    "repository": "https://github.com/Leo-sail/yunspire",
    "upstreamCodeCopied": false,
    "researchBoundary": "This template is an original Yunspire project asset. External repositories informed capability research only; no upstream code, prompt, template, wording, or visual asset is included."
  },
  "license": {
    "scope": "yunspire_first_party_project_asset",
    "notice": "Original Yunspire template manifest and Markdown entrypoint; use is governed by the repository LICENSE.",
    "thirdPartyAssets": []
  }
}
